{
  "$schema": "https://json-schema.org/draft/2020-12/schema",
  "schema_version": "1.0.0",
  "awsp_version": "1.3.0",
  "title": "AWSP Conversation Binding Schema",
  "description": "JSON Schema for the full CONVERSATION_BINDING.json file per AWSP v1.3.0",
  "type": "object",
  "required": [
    "schema_version",
    "awsp_version",
    "project_id",
    "project_root",
    "default_conversation_policy",
    "governance_scope",
    "bindings"
  ],
  "properties": {
    "schema_version": {
      "type": "string",
      "const": "1.0.0"
    },
    "awsp_version": {
      "type": "string",
      "const": "1.3.0"
    },
    "project_id": {
      "type": "string",
      "minLength": 1
    },
    "project_root": {
      "type": "string",
      "minLength": 1
    },
    "default_conversation_policy": {
      "type": "string",
      "enum": ["one_agent_one_conversation"]
    },
    "governance_scope": {
      "type": "object",
      "required": [
        "default_execution_policy",
        "forbid_ad_hoc_gpt_submission",
        "forbid_cross_repo_smoke_without_human_gate",
        "external_runtimes"
      ],
      "properties": {
        "default_execution_policy": {
          "type": "string",
          "enum": ["human_gated_for_external_runtime_execution"]
        },
        "forbid_ad_hoc_gpt_submission": {
          "type": "boolean",
          "const": true
        },
        "forbid_cross_repo_smoke_without_human_gate": {
          "type": "boolean",
          "const": true
        },
        "external_runtimes": {
          "type": "array",
          "minItems": 3,
          "items": {
            "type": "object",
            "required": [
              "runtime_id",
              "runtime_kind",
              "governance_status",
              "allowed_actions",
              "forbidden_actions",
              "human_gate_required"
            ],
            "properties": {
              "runtime_id": {
                "type": "string",
                "enum": [
                  "devframe-control-plane",
                  "dev-frame-opencode",
                  "paper-workflow"
                ]
              },
              "runtime_kind": {
                "type": "string",
                "enum": [
                  "control_plane",
                  "agent_dispatch",
                  "business_workflow"
                ]
              },
              "path": {
                "type": ["string", "null"]
              },
              "governance_status": {
                "type": "string",
                "enum": [
                  "in_scope_read_only",
                  "in_scope_human_gated",
                  "in_scope_pilot_only"
                ]
              },
              "allowed_actions": {
                "type": "array",
                "minItems": 1,
                "items": {
                  "type": "string"
                }
              },
              "forbidden_actions": {
                "type": "array",
                "minItems": 1,
                "items": {
                  "type": "string"
                }
              },
              "human_gate_required": {
                "type": "boolean",
                "const": true
              }
            },
            "additionalProperties": false
          }
        }
      },
      "additionalProperties": false
    },
    "bindings": {
      "type": "array",
      "minItems": 1,
      "items": {
        "type": "object",
        "required": [
          "agent_id",
          "role",
          "binding_status",
          "capture_policy"
        ],
        "properties": {
          "agent_id": {
            "type": "string",
            "minLength": 1
          },
          "role": {
            "type": "string",
            "enum": ["reviewer", "executor", "observer", "orchestrator"]
          },
          "binding_status": {
            "type": "string",
            "enum": [
              "pending_manual_binding",
              "active",
              "paused",
              "retired",
              "invalid"
            ]
          },
          "conversation_id": {
            "type": ["string", "null"]
          },
          "chat_url": {
            "type": ["string", "null"]
          },
          "browser_profile_id": {
            "type": ["string", "null"]
          },
          "cdp_endpoint": {
            "type": ["string", "null"]
          },
          "allowed_task_scope": {
            "type": "array",
            "items": {
              "type": "string"
            }
          },
          "capture_policy": {
            "type": "object",
            "required": [
              "must_match_run_id",
              "must_match_task_id",
              "must_include_end_marker",
              "forbid_last_message_only_capture"
            ],
            "properties": {
              "must_match_run_id": {
                "type": "boolean",
                "const": true
              },
              "must_match_task_id": {
                "type": "boolean",
                "const": true
              },
              "must_include_end_marker": {
                "type": "boolean",
                "const": true
              },
              "forbid_last_message_only_capture": {
                "type": "boolean",
                "const": true
              }
            },
            "additionalProperties": false
          }
        },
        "if": {
          "properties": {
            "binding_status": {
              "const": "active"
            }
          }
        },
        "then": {
          "anyOf": [
            {
              "required": ["chat_url"],
              "properties": {
                "chat_url": {
                  "type": "string",
                  "minLength": 1
                }
              }
            },
            {
              "required": ["conversation_id"],
              "properties": {
                "conversation_id": {
                  "type": "string",
                  "minLength": 1
                }
              }
            }
          ]
        },
        "additionalProperties": true
      }
    }
  },
  "additionalProperties": true
}
